{
  "schema_version": "1.0",
  "release_id": "MathGov/RippleLogic v13.0",
  "run_id": "SYNTHETIC-13-01",
  "configuration_hash": "3c403016e05315bd568551addd6a2a266b78c0f56e2e0bcd7804b0450feae632",
  "evidence_maturity": "SYNTHETIC",
  "observed_at": "2026-09-10T09:00:00Z",
  "received_at": "2026-09-10T09:00:01Z",
  "record_type": "QualifiedControlRecord",
  "control_id": "control-001",
  "hazard_endpoint_ref": "synthetic-endpoint",
  "action_ref": "proposed-rate-limit",
  "authority_ref": "synthetic-role-not-live",
  "resource_ref": "synthetic-resource-case",
  "trigger_ref": "synthetic-trigger",
  "control_time_upper": 3,
  "harm_time_lower": 8,
  "safety_margin": 1,
  "time_unit": "seconds",
  "prevention_evidence_ref": "synthetic-timing-test",
  "other_mitigation_refs": [],
  "expiry": "2026-09-11T09:00:00Z",
  "fallback_ref": "synthetic-fallback",
  "outcome_verification_ref": "external-measurement-required",
  "execution_authorized": false
}